{
  "name": "hakaisatsu-hermes",
  "type": "skill",
  "summary": {
    "en": "Hermes Agent integration: lets Hermes author Hakaisatsu JSON IR and render through the Hakaisatsu CLI — no code loaded into Hakaisatsu.",
    "zh": "Hakaisatsu 的 Hermes Agent 集成。以目录插件形式让 Hermes 编写 Hakaisatsu JSON IR 并通过 Hakaisatsu CLI 渲染图，不向 Hakaisatsu 本体加载任何代码。"
  },
  "author": {
    "name": "thomasardi",
    "url": "https://github.com/thomasardi"
  },
  "repository": "https://github.com/thomasardi/hakaisatsu/tree/main/integrations/hermes-agent",
  "hakaisatsu": ">=3.0.0 <4.0.0",
  "schemaVersions": [1, 2],
  "tags": ["hermes-agent", "integration", "opt-in"],
  "evidence": [
    {
      "label": "Plugin contract tests",
      "url": "https://github.com/thomasardi/hakaisatsu/tree/main/integrations/hermes-agent/test"
    }
  ]
}
